2015,2,EV,ExpressJet Airlines Inc.,RIC,"Richmond, VA: Richmond International",445,139,47.18,1.67,43.16,0,46.98,61,2,7820,2812,65,1733,0,3210
2015,2,EV,ExpressJet Airlines Inc.,CMH,"Columbus, OH: Port Columbus International",245,55,16.64,1.96,26,0,10.4,12,0,2690,922,96,1158,0,514
2015,2,EV,ExpressJet Airlines Inc.,BNA,"Nashville, TN: Nashville International",368,90,21.61,2.73,35.41,0,30.26,31,1,4484,1006,291,1329,0,1858
2015,2,EV,ExpressJet Airlines Inc.,HSV,"Huntsville, AL: Huntsville International-Carl T Jones Field",168,42,13.07,0,15.44,0,13.49,10,1,1741,517,0,593,0,631
2015,2,EV,ExpressJet Airlines Inc.,ICT,"Wichita, KS: Wichita Dwight D Eisenhower National",132,26,6.32,1.59,13.56,0,4.53,8,1,938,332,39,439,0,128
2015,2,EV,ExpressJet Airlines Inc.,CRW,"Charleston/Dunbar, WV: Yeager",143,32,11.85,0,9.15,0,11.01,16,2,2184,1116,0,536,0,532
2015,2,EV,ExpressJet Airlines Inc.,SPS,"Wichita Falls, TX: Sheppard AFB/Wichita Falls Municipal",19,1,0,0,0,0,1,4,1,320,0,0,0,0,320
2015,2,EV,ExpressJet Airlines Inc.,LIT,"Little Rock, AR: Bill and Hillary Clinton Nat Adams Field",235,44,14.26,1.58,9.71,0,18.45,16,0,2251,578,87,399,0,1187
2015,2,EV,ExpressJet Airlines Inc.,MEI,"Meridian, MS: Key Field",76,16,4.91,0,3.11,0,7.98,4,0,1224,581,0,176,0,467
2015,2,EV,ExpressJet Airlines Inc.,PIB,"Hattiesburg/Laurel, MS: Hattiesburg-Laurel Regional",48,15,1.34,0,0.64,0,13.01,3,0,857,29,0,29,0,799
2015,2,EV,ExpressJet Airlines Inc.,GRR,"Grand Rapids, MI: Gerald R. Ford International",174,42,9.61,0.87,16.04,0,15.48,11,0,2425,788,34,621,0,982
2015,2,EV,ExpressJet Airlines Inc.,RAP,"Rapid City, SD: Rapid City Regional",36,10,5,0,3.72,0,1.29,3,0,403,179,0,137,0,87
2015,2,EV,ExpressJet Airlines Inc.,MHK,"Manhattan/Ft. Riley, KS: Manhattan Regional",11,2,0.65,0,0.14,0,1.21,0,0,145,37,0,11,0,97
2015,2,EV,ExpressJet Airlines Inc.,GGG,"Longview, TX: East Texas Regional",30,4,2.07,0,1.93,0,0,4,0,167,59,0,108,0,0
2015,2,EV,ExpressJet Airlines Inc.,AMA,"Amarillo, TX: Rick Husband Amarillo International",104,15,2.97,0,9.15,0,2.89,4,0,714,281,0,333,0,100
2015,2,EV,ExpressJet Airlines Inc.,MFE,"Mission/McAllen/Edinburg, TX: McAllen Miller International",170,27,7.85,0,10.9,0,8.24,1,1,1060,261,0,370,0,429
2015,2,EV,ExpressJet Airlines Inc.,BHM,"Birmingham, AL: Birmingham-Shuttlesworth International",304,87,22.6,4.39,32.26,0,27.75,12,0,4417,1317,173,1185,0,1742
2015,2,EV,ExpressJet Airlines Inc.,LGA,"New York, NY: LaGuardia",977,338,112.19,3.28,136.41,0,86.12,163,4,22160,8735,230,7180,0,6015
2015,2,EV,ExpressJet Airlines Inc.,SDF,"Louisville, KY: Louisville International-Standiford Field",191,44,14.3,2.36,16.52,0,10.82,17,0,2095,865,162,445,0,623
2015,2,EV,ExpressJet Airlines Inc.,SWF,"Newburgh/Poughkeepsie, NY: Stewart International",11,3,2.02,0,0.3,0,0.67,2,0,237,148,0,20,0,69
2015,2,EV,ExpressJet Airlines Inc.,ALB,"Albany, NY: Albany International",75,24,8.44,0.09,9.37,0,6.09,4,0,1149,507,4,361,0,277
2015,2,EV,ExpressJet Airlines Inc.,MAF,"Midland/Odessa, TX: Midland International",206,29,6.89,0.69,14.77,0,6.65,3,1,987,209,24,390,0,364
2015,2,EV,ExpressJet Airlines Inc.,PNS,"Pensacola, FL: Pensacola International",117,19,8.33,0,6.96,0,3.71,0,0,715,345,0,212,0,158
2015,2,EV,ExpressJet Airlines Inc.,DAY,"Dayton, OH: James M Cox/Dayton International",180,47,12.14,1.36,10.23,0,23.26,16,0,2546,676,92,438,0,1340
2015,2,EV,ExpressJet Airlines Inc.,MSN,"Madison, WI: Dane County Regional-Truax Field",185,63,17.08,3.65,17.22,0,25.04,10,0,3177,1040,242,844,0,1051
2015,2,EV,ExpressJet Airlines Inc.,BTV,"Burlington, VT: Burlington International",95,32,15.07,0,10.87,0,6.06,7,0,1718,882,0,395,0,441
2015,2,EV,ExpressJet Airlines Inc.,MTJ,"Montrose/Delta, CO: Montrose Regional",35,6,0.83,0,2.04,0,3.13,0,0,251,53,0,52,0,146
2015,2,EV,ExpressJet Airlines Inc.,MSY,"New Orleans, LA: Louis Armstrong New Orleans International",25,6,1.91,1,2.09,0,1,1,0,199,64,65,44,0,26
2015,2,EV,ExpressJet Airlines Inc.,XNA,"Fayetteville, AR: Northwest Arkansas Regional",255,67,23.86,0.03,25.06,0,18.05,8,1,3223,1353,1,848,0,1021
2015,2,EV,ExpressJet Airlines Inc.,LAN,"Lansing, MI: Capital Region International",100,29,9.08,2.02,7.9,0,10,4,0,1714,597,126,295,0,696
2015,2,EV,ExpressJet Airlines Inc.,BUF,"Buffalo, NY: Buffalo Niagara International",148,43,16.49,0.24,10.45,0,15.82,11,0,2655,1223,21,380,0,1031
2015,2,EV,ExpressJet Airlines Inc.,BWI,"Baltimore, MD: Baltimore/Washington International Thurgood Marshall",41,11,4.55,0,3.06,0,3.38,5,0,454,282,0,79,0,93
2015,2,EV,ExpressJet Airlines Inc.,ROA,"Roanoke, VA: Roanoke Regional/Woodrum Field",119,22,6.28,0.68,5.17,0,9.86,13,3,1444,360,74,222,0,788
2015,2,EV,ExpressJet Airlines Inc.,STL,"St. Louis, MO: Lambert-St. Louis International",261,52,14.68,4.86,18.05,0,14.41,17,2,3021,972,539,611,0,899
2015,2,EV,ExpressJet Airlines Inc.,CID,"Cedar Rapids/Iowa City, IA: The Eastern Iowa",177,61,23.12,1.22,13.85,0,22.81,7,0,4053,1915,166,599,0,1373
2015,2,EV,ExpressJet Airlines Inc.,SBN,"South Bend, IN: South Bend International",116,37,14.25,1.58,10.53,0,10.64,13,1,2205,1096,53,602,0,454
2015,2,EV,ExpressJet Airlines Inc.,DSM,"Des Moines, IA: Des Moines International",118,46,11.87,1.08,14.44,0,18.62,3,0,2181,531,54,524,0,1072
2015,2,EV,ExpressJet Airlines Inc.,MOT,"Minot, ND: Minot International",24,5,2.58,0,1.67,0,0.75,3,0,239,158,0,51,0,30
2015,2,EV,ExpressJet Airlines Inc.,CHS,"Charleston, SC: Charleston AFB/International",118,27,8.4,0.94,6.28,0,11.38,14,0,1321,384,60,221,0,656
2015,2,EV,ExpressJet Airlines Inc.,AEX,"Alexandria, LA: Alexandria International",179,30,9.49,1,6.14,0,13.38,8,1,1547,515,59,190,0,783
2015,2,EV,ExpressJet Airlines Inc.,ORF,"Norfolk, VA: Norfolk International",186,49,16.7,0,15.31,0,16.98,21,1,3202,1618,0,670,0,914
2015,2,EV,ExpressJet Airlines Inc.,TVC,"Traverse City, MI: Cherry Capital",111,37,10.32,4.35,9.91,0,12.42,7,0,2005,617,243,395,0,750
2015,2,EV,ExpressJet Airlines Inc.,CVG,"Cincinnati, OH: Cincinnati/Northern Kentucky International",318,85,23.09,3.06,42.46,0,16.39,19,0,4392,1500,179,1594,0,1119
2015,2,EV,ExpressJet Airlines Inc.,FNT,"Flint, MI: Bishop International",67,24,4.81,1.48,8.06,0,9.65,5,0,1083,270,74,302,0,437
2015,2,EV,ExpressJet Airlines Inc.,ATL,"Atlanta, GA: Hartsfield-Jackson Atlanta International",4630,982,270.43,0,234.8,0,476.77,228,7,66951,24805,0,8576,0,33570
2015,2,EV,ExpressJet Airlines Inc.,BOS,"Boston, MA: Logan International",185,55,21.92,0.89,24.82,0,7.38,37,0,3358,1605,23,1323,0,407
2015,2,EV,ExpressJet Airlines Inc.,PVD,"Providence, RI: Theodore Francis Green State",118,34,8.1,1.37,10.79,0,13.75,16,2,1519,458,57,510,0,494
2015,2,EV,ExpressJet Airlines Inc.,OMA,"Omaha, NE: Eppley Airfield",220,40,8.53,0,19.7,0,11.77,11,1,2087,476,0,691,0,920
2015,2,EV,ExpressJet Airlines Inc.,PIT,"Pittsburgh, PA: Pittsburgh International",263,73,23.44,5.07,25.05,0,19.44,17,0,4377,1590,382,1266,0,1139
2015,2,EV,ExpressJet Airlines Inc.,GUC,"Gunnison, CO: Gunnison-Crested Butte Regional",43,9,2.84,0,3.06,0,3.09,6,0,307,82,0,70,0,155
2015,2,EV,ExpressJet Airlines Inc.,HRL,"Harlingen/San Benito, TX: Valley International",104,10,2.86,0,5.83,0,1.31,0,2,287,107,0,147,0,33
2015,2,EV,ExpressJet Airlines Inc.,ABQ,"Albuquerque, NM: Albuquerque International Sunport",72,10,3.65,0.91,2.66,0,2.77,1,1,823,227,143,317,0,136
2015,2,EV,ExpressJet Airlines Inc.,CLL,"College Station/Bryan, TX: Easterwood Field",50,4,1,0,0.56,0,2.44,0,0,134,41,0,19,0,74
2015,2,EV,ExpressJet Airlines Inc.,RDU,"Raleigh/Durham, NC: Raleigh-Durham International",212,42,14.65,1,15.11,0,11.24,24,0,2785,1030,188,508,0,1059
2015,2,EV,ExpressJet Airlines Inc.,DAL,"Dallas, TX: Dallas Love Field",182,17,4.03,0,8.64,0,4.33,16,1,542,152,0,235,0,155
2015,2,EV,ExpressJet Airlines Inc.,PWM,"Portland, ME: Portland International Jetport",70,18,5.5,0,6.07,0,6.44,6,1,688,191,0,232,0,265
2015,2,EV,ExpressJet Airlines Inc.,JAX,"Jacksonville, FL: Jacksonville International",158,43,15.18,0,16.98,0,10.84,11,0,2661,1338,0,674,0,649
2015,2,EV,ExpressJet Airlines Inc.,VPS,"Valparaiso, FL: Northwest Florida Regional",97,16,7.35,0,4.47,0,4.18,0,1,700,242,0,142,0,316
2015,2,EV,ExpressJet Airlines Inc.,DCA,"Washington, DC: Ronald Reagan Washington National",277,57,13.94,3.16,16.74,0,23.17,32,0,2696,753,251,790,0,902
2015,2,EV,ExpressJet Airlines Inc.,JAN,"Jackson/Vicksburg, MS: Jackson Medgar Wiley Evers International",229,41,16.05,0.6,15.96,0,8.39,18,1,2312,788,37,596,0,891
2015,2,EV,ExpressJet Airlines Inc.,RSW,"Fort Myers, FL: Southwest Florida International",2,1,0.03,0,0.97,0,0,0,0,36,1,0,35,0,0
2015,2,EV,ExpressJet Airlines Inc.,GSO,"Greensboro/High Point, NC: Piedmont Triad International",340,105,42.32,0.68,19.88,0,42.11,35,0,6642,2948,26,739,0,2929
2015,2,EV,ExpressJet Airlines Inc.,DIK,"Dickinson, ND: Dickinson - Theodore Roosevelt Regional",48,15,3.89,0,5.77,0,5.34,3,2,1050,533,0,306,0,211
2015,2,EV,ExpressJet Airlines Inc.,GPT,"Gulfport/Biloxi, MS: Gulfport-Biloxi International",139,18,5.61,0,5.34,0,7.05,0,0,871,370,0,106,0,395
2015,2,EV,ExpressJet Airlines Inc.,LNK,"Lincoln, NE: Lincoln Airport",122,39,8.74,2.15,10.2,0,17.91,7,0,1922,442,106,407,0,967
2015,2,EV,ExpressJet Airlines Inc.,MKE,"Milwaukee, WI: General Mitchell International",207,41,12.56,1.54,15.32,0,11.58,11,0,1832,593,155,504,0,580
2015,2,EV,ExpressJet Airlines Inc.,HOB,"Hobbs, NM: Lea County Regional",47,9,4.22,0,3.3,0,1.48,2,1,419,247,0,78,0,94
2015,2,EV,ExpressJet Airlines Inc.,TUS,"Tucson, AZ: Tucson International",71,12,3.02,0,4.72,0,4.27,0,1,438,145,0,115,0,178
2015,2,EV,ExpressJet Airlines Inc.,SAF,"Santa Fe, NM: Santa Fe Municipal",45,17,6.9,0,4.92,0,5.19,5,0,826,345,0,200,0,281
2015,2,EV,ExpressJet Airlines Inc.,DRO,"Durango, CO: Durango La Plata County",15,2,1,0,0.25,0,0.75,0,0,82,26,0,14,0,42
2015,2,EV,ExpressJet Airlines Inc.,LRD,"Laredo, TX: Laredo International",75,8,1.18,0,4.22,0,2.6,0,1,291,90,0,113,0,88
2015,2,EV,ExpressJet Airlines Inc.,SAV,"Savannah, GA: Savannah/Hilton Head International",172,54,14.95,1.76,14.8,0,22.49,6,0,3671,1213,106,714,0,1638
2015,2,EV,ExpressJet Airlines Inc.,MHT,"Manchester, NH: Manchester-Boston Regional",86,20,4.25,0,9.3,0,6.45,14,0,902,283,0,277,0,342
2015,2,EV,ExpressJet Airlines Inc.,CAE,"Columbia, SC: Columbia Metropolitan",306,99,30.1,3.4,27.42,0,38.08,11,1,6076,1946,314,1268,0,2548
2015,2,EV,ExpressJet Airlines Inc.,LBB,"Lubbock, TX: Lubbock Preston Smith International",132,30,6.54,0,16.37,0,7.09,5,0,1172,406,0,424,0,342
2015,2,EV,ExpressJet Airlines Inc.,BDL,"Hartford, CT: Bradley International",108,21,9,0.93,3.35,0,7.72,11,1,2057,1153,120,203,0,581
2015,2,EV,ExpressJet Airlines Inc.,GJT,"Grand Junction, CO: Grand Junction Regional",15,6,2.25,0,2.18,0,1.57,0,0,305,99,0,73,0,133
2015,2,EV,ExpressJet Airlines Inc.,PBI,"West Palm Beach/Palm Beach, FL: Palm Beach International",11,3,0.79,0,1.01,0,1.21,0,0,108,22,0,39,0,47
2015,2,EV,ExpressJet Airlines Inc.,CWA,"Mosinee, WI: Central Wisconsin",56,19,3.56,0.71,5.45,0,9.28,4,0,1406,393,55,263,0,695
2015,2,EV,ExpressJet Airlines Inc.,LEX,"Lexington, KY: Blue Grass",238,52,20.75,1.39,14.27,0,15.59,21,4,2354,934,76,516,0,828
2015,2,EV,ExpressJet Airlines Inc.,GRB,"Green Bay, WI: Austin Straubel International",144,38,8.5,2.62,11.58,0,15.3,13,1,2704,902,143,624,0,1035
2015,2,EV,ExpressJet Airlines Inc.,ATW,"Appleton, WI: Outagamie County Regional",152,47,9.15,3.25,12.44,0,22.17,8,0,2802,652,295,584,0,1271
2015,2,EV,ExpressJet Airlines Inc.,AUS,"Austin, TX: Austin - Bergstrom International",41,13,5.01,0,4.12,0,3.87,1,0,913,320,0,141,0,452
2015,2,EV,ExpressJet Airlines Inc.,FAR,"Fargo, ND: Hector International",86,25,7.44,4.87,5.03,0,7.66,3,1,1735,385,293,241,0,816
2015,2,EV,ExpressJet Airlines Inc.,PIA,"Peoria, IL: General Downing - Peoria International",116,30,8.15,1.21,6.05,0,14.6,5,1,1668,568,40,264,0,796
2015,2,EV,ExpressJet Airlines Inc.,AVL,"Asheville, NC: Asheville Regional",101,16,4.69,0,1.57,0,9.75,3,1,799,196,0,67,0,536
2015,2,EV,ExpressJet Airlines Inc.,EVV,"Evansville, IN: Evansville Regional",119,23,11.1,0,5.05,0,6.85,6,1,1663,963,0,188,0,512
2015,2,EV,ExpressJet Airlines Inc.,FSM,"Fort Smith, AR: Fort Smith Regional",77,18,6.14,0,3.89,0,7.98,0,0,1375,618,0,129,0,628
2015,2,EV,ExpressJet Airlines Inc.,MDW,"Chicago, IL: Chicago Midway International",177,62,24.63,0,18.15,0,19.22,6,0,4409,2391,0,752,0,1266
2015,2,EV,ExpressJet Airlines Inc.,AZO,"Kalamazoo, MI: Kalamazoo/Battle Creek International",27,5,1.68,0,1.32,0,2,4,0,242,113,0,63,0,66
2015,2,EV,ExpressJet Airlines Inc.,AGS,"Augusta, GA: Augusta Regional at Bush Field",131,32,14.04,0,3.02,0,14.94,3,0,1900,862,0,95,0,943
2015,2,EV,ExpressJet Airlines Inc.,GNV,"Gainesville, FL: Gainesville Regional",125,22,7.46,0,3.11,0,11.43,2,1,1256,484,0,92,0,680
2015,2,EV,ExpressJet Airlines Inc.,ILM,"Wilmington, NC: Wilmington International",102,10,6.52,0,0.53,0,2.95,5,0,453,340,0,21,0,92
2015,2,EV,ExpressJet Airlines Inc.,ERI,"Erie, PA: Erie International/Tom Ridge Field",78,17,3.67,1.96,4.53,0,6.84,10,1,1104,250,110,143,0,601
2015,2,EV,ExpressJet Airlines Inc.,ECP,"Panama City, FL: Northwest Florida Beaches International",8,1,1,0,0,0,0,0,0,46,46,0,0,0,0
2015,2,EV,ExpressJet Airlines Inc.,SCE,"State College, PA: University Park",59,24,9.15,0.96,4.55,0,9.34,6,2,1411,511,51,304,0,545
2015,2,EV,ExpressJet Airlines Inc.,CHA,"Chattanooga, TN: Lovell Field",126,23,7.85,0,4.48,0,10.67,9,0,1180,545,0,186,0,449
2015,2,EV,ExpressJet Airlines Inc.,FWA,"Fort Wayne, IN: Fort Wayne International",28,10,4.92,0,1.62,0,3.46,1,0,792,461,0,62,0,269
2015,2,EV,ExpressJet Airlines Inc.,RST,"Rochester, MN: Rochester International",55,18,8.97,0,3.41,0,5.61,1,2,1108,429,0,114,0,565
2015,2,EV,ExpressJet Airlines Inc.,TLH,"Tallahassee, FL: Tallahassee Regional",58,17,9.09,0,2.94,0,4.97,0,0,996,679,0,61,0,256
2015,2,EV,ExpressJet Airlines Inc.,BIS,"Bismarck/Mandan, ND: Bismarck Municipal",36,9,2.18,0,3.03,0,3.79,3,0,837,518,0,110,0,209
2015,2,EV,ExpressJet Airlines Inc.,MBS,"Saginaw/Bay City/Midland, MI: MBS International",38,8,2.55,0,1.42,0,4.04,3,0,540,158,0,72,0,310
2015,2,EV,ExpressJet Airlines Inc.,BQK,"Brunswick, GA: Brunswick Golden Isles",78,16,7.24,0,1.06,0,7.69,0,0,1150,331,0,73,0,746
2015,2,EV,ExpressJet Airlines Inc.,MCO,"Orlando, FL: Orlando International",14,4,3.97,0,0.03,0,0,0,0,379,378,0,1,0,0
2015,2,EV,ExpressJet Airlines Inc.,ABE,"Allentown/Bethlehem/Easton, PA: Lehigh Valley International",139,44,14.23,2.51,11.86,0,15.41,8,0,2602,1076,151,408,0,967
2015,2,EV,ExpressJet Airlines Inc.,CHO,"Charlottesville, VA: Charlottesville Albemarle",76,24,8.4,0,1.29,0,14.31,8,0,1578,524,0,87,0,967
2015,2,EV,ExpressJet Airlines Inc.,PHF,"Newport News/Williamsburg, VA: Newport News/Williamsburg International",78,9,6.75,0,0.42,0,1.83,5,0,514,401,0,22,0,91
2015,2,EV,ExpressJet Airlines Inc.,DHN,"Dothan, AL: Dothan Regional",106,16,6.12,0,2.09,0,7.79,7,0,773,300,0,91,0,382
2015,2,EV,ExpressJet Airlines Inc.,AVP,"Scranton/Wilkes-Barre, PA: Wilkes Barre Scranton International",90,32,13.21,1.23,10.07,0,7.49,5,0,1361,459,43,403,0,456
2015,2,EV,ExpressJet Airlines Inc.,ELM,"Elmira/Corning, NY: Elmira/Corning Regional",171,70,24.01,1.63,18.88,0,25.48,11,0,4024,1701,87,661,0,1575
2015,2,EV,ExpressJet Airlines Inc.,VLD,"Valdosta, GA: Valdosta Regional",78,11,5.81,0,1.63,0,3.56,2,2,498,291,0,53,0,154
2015,2,EV,ExpressJet Airlines Inc.,MGM,"Montgomery, AL: Montgomery Regional",177,36,12.48,0,7.57,0,15.95,3,0,2005,795,0,236,0,974
2015,2,EV,ExpressJet Airlines Inc.,GTR,"Columbus, MS: Golden Triangle Regional",78,16,7.22,0,1.6,0,7.18,7,1,985,457,0,31,0,497
2015,2,EV,ExpressJet Airlines Inc.,ITH,"Ithaca/Cortland, NY: Ithaca Tompkins Regional",6,2,0.46,0,1.54,0,0,2,0,69,24,0,45,0,0
2015,2,EV,ExpressJet Airlines Inc.,BGM,"Binghamton, NY: Greater Binghamton/Edwin A. Link Field",38,12,1.92,0,2.24,0,7.84,2,0,851,150,0,84,0,617
2015,2,EV,ExpressJet Airlines Inc.,BMI,"Bloomington/Normal, IL: Central Illinois Regional",83,28,12.78,0,4.44,0,10.78,2,0,1739,934,0,179,0,626
2015,2,EV,ExpressJet Airlines Inc.,FAY,"Fayetteville, NC: Fayetteville Regional/Grannis Field",121,22,11.1,0,2.67,0,8.23,9,0,1567,791,0,95,0,681
2015,2,EV,ExpressJet Airlines Inc.,MYR,"Myrtle Beach, SC: Myrtle Beach International",61,9,4.75,0,1.45,0,2.79,2,0,774,404,0,50,0,320
2015,2,EV,ExpressJet Airlines Inc.,TRI,"Bristol/Johnson City/Kingsport, TN: Tri-Cities Regional TN/VA",116,15,8.1,0,1.25,0,5.65,5,0,847,524,0,55,0,268
2015,2,EV,ExpressJet Airlines Inc.,OAJ,"Jacksonville/Camp Lejeune, NC: Albert J Ellis",102,15,9.28,0,2.69,0,3.03,6,0,1184,735,0,100,0,349
2015,2,EV,ExpressJet Airlines Inc.,CSG,"Columbus, GA: Columbus Airport",91,23,10.71,0,3.59,0,8.71,1,0,1130,640,0,79,0,411
2015,2,EV,ExpressJet Airlines Inc.,BGR,"Bangor, ME: Bangor International",22,11,2.48,0,4.97,0,3.56,1,0,378,87,0,127,0,164
2015,2,EV,ExpressJet Airlines Inc.,ABY,"Albany, GA: Southwest Georgia Regional",75,14,5.61,0,3.31,0,5.08,2,1,721,314,0,71,0,336
2015,2,EV,ExpressJet Airlines Inc.,EWN,"New Bern/Morehead/Beaufort, NC: Coastal Carolina Regional",51,9,4.19,0,2.12,0,2.69,2,0,411,198,0,103,0,110
2015,2,EV,ExpressJet Airlines Inc.,EYW,"Key West, FL: Key West International",28,7,4.33,0,0,0,2.67,0,0,688,551,0,0,0,137
2015,2,F9,Frontier Airlines Inc.,PHL,"Philadelphia, PA: Philadelphia International",107,43,11.08,0,20.09,0,11.82,6,0,3532,818,0,1194,0,1520
2015,2,F9,Frontier Airlines Inc.,MIA,"Miami, FL: Miami International",161,68,13.64,2.49,34.73,0,17.13,6,0,4135,779,285,1921,0,1150
2015,2,F9,Frontier Airlines Inc.,CVG,"Cincinnati, OH: Cincinnati/Northern Kentucky International",101,41,14.23,0,18.39,0,8.38,1,0,3351,1220,0,1137,0,994
2015,2,F9,Frontier Airlines Inc.,DEN,"Denver, CO: Denver International",1618,554,108.29,5.28,280.66,0,159.77,14,2,43056,10261,792,15159,0,16844
2015,2,F9,Frontier Airlines Inc.,ORD,"Chicago, IL: Chicago O'Hare International",261,144,27.25,1.71,69.72,0,45.32,5,0,11498,1818,237,4606,0,4837
2015,2,F9,Frontier Airlines Inc.,ATL,"Atlanta, GA: Hartsfield-Jackson Atlanta International",161,54,13.26,2.87,25.65,0,12.22,1,0,4984,898,565,2088,0,1433
2015,2,F9,Frontier Airlines Inc.,LAS,"Las Vegas, NV: McCarran International",215,103,15.64,0.43,55.15,0,31.79,1,1,6480,1036,47,2723,0,2674
2015,2,F9,Frontier Airlines Inc.,DCA,"Washington, DC: Ronald Reagan Washington National",80,27,5.54,0,16.47,0,4.98,1,0,1372,252,0,736,0,384
2015,2,F9,Frontier Airlines Inc.,SAN,"San Diego, CA: San Diego International",52,17,2.29,0,6.26,0,8.45,1,0,1388,205,0,354,0,829
2015,2,F9,Frontier Airlines Inc.,IAD,"Washington, DC: Washington Dulles International",187,88,22.48,0.21,26.29,0,39.02,8,2,7065,1516,6,1439,0,4104
2015,2,F9,Frontier Airlines Inc.,PBI,"West Palm Beach/Palm Beach, FL: Palm Beach International",44,13,2.63,0,6.58,0,3.79,3,0,797,150,0,264,0,383
2015,2,F9,Frontier Airlines Inc.,STL,"St. Louis, MO: Lambert-St. Louis International",81,43,8.96,0,20.51,0,13.52,1,0,2966,631,0,1034,0,1301
2015,2,F9,Frontier Airlines Inc.,FLL,"Fort Lauderdale, FL: Fort Lauderdale-Hollywood International",100,47,11.97,2.05,17.83,0,15.15,4,0,4616,949,156,806,0,2705
2015,2,F9,Frontier Airlines Inc.,SLC,"Salt Lake City, UT: Salt Lake City International",127,50,8.66,0.8,25.51,0,15.03,1,0,3252,534,45,1324,0,1349
2015,2,F9,Frontier Airlines Inc.,MKE,"Milwaukee, WI: General Mitchell International",76,27,3.38,0,17.92,0,5.7,1,0,1733,251,0,850,0,632
2015,2,F9,Frontier Airlines Inc.,IND,"Indianapolis, IN: Indianapolis International",29,12,0.85,0.29,7.43,0,3.42,1,0,770,26,10,409,0,325
2015,2,F9,Frontier Airlines Inc.,CLE,"Cleveland, OH: Cleveland-Hopkins International",234,121,19.67,0,48.94,0,52.39,6,1,8535,1082,0,2250,0,5203
2015,2,F9,Frontier Airlines Inc.,TPA,"Tampa, FL: Tampa International",157,66,15.8,0.88,29.53,0,19.8,2,0,5876,2002,101,1490,0,2283
2015,2,F9,Frontier Airlines Inc.,LAX,"Los Angeles, CA: Los Angeles International",72,20,3.91,0.04,12.53,0,3.51,0,0,1003,146,2,581,0,274
2015,2,F9,Frontier Airlines Inc.,MCO,"Orlando, FL: Orlando International",397,169,39.93,6.45,85.37,0,37.24,12,0,15379,3627,648,5304,0,5800
2015,2,F9,Frontier Airlines Inc.,DTW,"Detroit, MI: Detroit Metro Wayne County",16,4,0.5,0.08,0.84,0,2.58,0,0,253,22,10,101,0,120
2015,2,F9,Frontier Airlines Inc.,PDX,"Portland, OR: Portland International",40,13,1.09,0,7.15,0,4.76,0,0,1287,61,0,643,0,583
2015,2,F9,Frontier Airlines Inc.,RSW,"Fort Myers, FL: Southwest Florida International",136,50,17.64,1.38,23.05,0,7.93,6,0,3189,1105,149,1218,0,717
2015,2,F9,Frontier Airlines Inc.,PHX,"Phoenix, AZ: Phoenix Sky Harbor International",206,74,16.86,1.58,39.79,0,15.77,2,0,4010,1159,369,1557,0,925
2015,2,F9,Frontier Airlines Inc.,TTN,"Trenton, NJ: Trenton Mercer",208,105,18.29,2.59,33.09,0,51.04,14,2,11355,1154,623,2282,0,7296
2015,2,F9,Frontier Airlines Inc.,BZN,"Bozeman, MT: Bozeman Yellowstone International",16,3,1.22,0,1,0,0.78,0,0,197,54,0,82,0,61
2015,2,F9,Frontier Airlines Inc.,DFW,"Dallas/Fort Worth, TX: Dallas/Fort Worth International",85,32,6.51,0,17.73,0,7.77,0,1,1772,376,0,629,0,767
2015,2,F9,Frontier Airlines Inc.,IAH,"Houston, TX: George Bush Intercontinental/Houston",104,23,3.16,0,11.63,0,8.21,0,0,1154,196,0,459,0,499
2015,2,F9,Frontier Airlines Inc.,SFO,"San Francisco, CA: San Francisco International",128,55,8.41,0.21,35.78,0,10.6,0,0,4203,1255,24,2010,0,914
2015,2,F9,Frontier Airlines Inc.,SNA,"Santa Ana, CA: John Wayne Airport-Orange County",79,19,1.17,0.54,13.73,0,3.56,0,0,858,54,18,546,0,240
2015,2,F9,Frontier Airlines Inc.,MCI,"Kansas City, MO: Kansas City International",32,8,0.93,0,2.95,0,4.12,0,0,503,45,0,196,0,262
2015,2,F9,Frontier Airlines Inc.,MSP,"Minneapolis, MN: Minneapolis-St Paul International",56,20,1.67,0,8.7,0,9.64,0,0,1255,77,0,473,0,705
2015,2,F9,Frontier Airlines Inc.,FAR,"Fargo, ND: Hector International",12,8,2.54,0.02,3.69,0,1.75,0,0,756,157,1,180,0,418
2015,2,F9,Frontier Airlines Inc.,OKC,"Oklahoma City, OK: Will Rogers World",24,6,2.24,0,2.3,0,1.46,2,0,463,235,0,81,0,147
2015,2,F9,Frontier Airlines Inc.,ILG,"Wilmington, DE: New Castle",20,5,2.73,0,1.33,0,0.94,2,0,452,232,0,96,0,124
2015,2,F9,Frontier Airlines Inc.,SEA,"Seattle, WA: Seattle/Tacoma International",36,14,1.3,0.03,8.78,0,3.89,0,0,1247,60,7,572,0,608
2015,2,F9,Frontier Airlines Inc.,MSN,"Madison, WI: Dane County Regional-Truax Field",28,9,1.4,0,3.02,0,4.59,0,0,852,421,0,177,0,254
2015,2,F9,Frontier Airlines Inc.,MDT,"Harrisburg, PA: Harrisburg International",20,3,1.09,0,0.38,0,1.52,0,0,740,52,0,148,0,540
2015,2,F9,Frontier Airlines Inc.,BMI,"Bloomington/Normal, IL: Central Illinois Regional",8,6,1.61,0,2.77,0,1.62,0,0,391,157,0,136,0,98
2015,2,F9,Frontier Airlines Inc.,DSM,"Des Moines, IA: Des Moines International",12,3,0.58,0.05,2.37,0,0,0,0,99,11,2,86,0,0
2015,2,F9,Frontier Airlines Inc.,BNA,"Nashville, TN: Nashville International",28,4,0.72,0,3.23,0,0.05,1,0,119,23,0,95,0,1
2015,2,F9,Frontier Airlines Inc.,OMA,"Omaha, NE: Eppley Airfield",36,11,0.39,0,7.72,0,2.89,0,0,1115,28,0,697,0,390
2015,2,F9,Frontier Airlines Inc.,FSD,"Sioux Falls, SD: Joe Foss Field",16,9,1.72,0,4.5,0,2.78,0,0,848,153,0,211,0,484
2015,2,F9,Frontier Airlines Inc.,MEM,"Memphis, TN: Memphis International",16,2,1,0,1,0,0,0,0,66,22,0,44,0,0
2015,2,F9,Frontier Airlines Inc.,MSY,"New Orleans, LA: Louis Armstrong New Orleans International",28,6,0.07,0,4.4,0,1.52,0,0,314,7,0,168,0,139
2015,2,F9,Frontier Airlines Inc.,LGA,"New York, NY: LaGuardia",56,33,7.77,0,22.33,0,2.9,2,1,1941,450,0,1242,0,249
2015,2,F9,Frontier Airlines Inc.,AUS,"Austin, TX: Austin - Bergstrom International",44,20,2.21,1,11,0,5.78,0,0,1193,153,37,439,0,564
2015,2,F9,Frontier Airlines Inc.,MDW,"Chicago, IL: Chicago Midway International",12,4,2.5,0.92,0.58,0,0,0,0,251,102,129,20,0,0
2015,2,F9,Frontier Airlines Inc.,UST,"St. Augustine, FL: Northeast Florida Regional",13,5,0.19,0,1.93,0,2.88,2,0,383,4,0,98,0,281
2015,2,F9,Frontier Airlines Inc.,CLT,"Charlotte, NC: Charlotte Douglas International",18,7,1.33,0,1.16,0,4.51,1,0,512,43,0,84,0,385
2015,2,F9,Frontier Airlines Inc.,RDU,"Raleigh/Durham, NC: Raleigh-Durham International",16,6,1.91,0.22,1.81,0,2.07,1,0,820,106,15,203,0,496
2015,2,HA,Hawaiian Airlines Inc.,HNL,"Honolulu, HI: Honolulu International",2525,537,239.01,42.39,22.68,1.31,231.61,2,0,22376,12089,1529,529,25,8204
2015,2,HA,Hawaiian Airlines Inc.,KOA,"Kona, HI: Kona International Airport at Keahole",580,73,20.37,2.79,3.68,0,46.17,0,1,1974,564,61,75,0,1274
2015,2,HA,Hawaiian Airlines Inc.,ITO,"Hilo, HI: Hilo International",444,65,17.78,1.43,0.76,0,45.02,0,0,1950,544,86,17,0,1303
2015,2,HA,Hawaiian Airlines Inc.,LIH,"Lihue, HI: Lihue Airport",583,75,21.98,4.89,2.26,0,45.87,0,0,2339,695,120,40,0,1484
2015,2,HA,Hawaiian Airlines Inc.,OGG,"Kahului, HI: Kahului Airport",1103,176,83.85,5.85,2.6,0,83.69,1,1,6029,3019,201,56,0,2753
2015,2,HA,Hawaiian Airlines Inc.,SMF,"Sacramento, CA: Sacramento International",28,8,8,0,0,0,0,0,0,223,223,0,0,0,0
2015,2,HA,Hawaiian Airlines Inc.,SEA,"Seattle, WA: Seattle/Tacoma International",56,6,4,1,0,0,1,0,0,454,201,206,0,0,47
2015,2,HA,Hawaiian Airlines Inc.,OAK,"Oakland, CA: Metropolitan Oakland International",56,13,10.31,0,0,0,2.69,0,0,553,395,0,0,0,158
2015,2,HA,Hawaiian Airlines Inc.,PDX,"Portland, OR: Portland International",28,3,3,0,0,0,0,0,0,100,100,0,0,0,0
2015,2,HA,Hawaiian Airlines Inc.,LAX,"Los Angeles, CA: Los Angeles International",112,14,12.18,0,0,0,1.82,0,1,596,553,0,0,0,43
2015,2,HA,Hawaiian Airlines Inc.,PHX,"Phoenix, AZ: Phoenix Sky Harbor International",28,5,5,0,0,0,0,0,0,131,131,0,0,0,0
2015,2,HA,Hawaiian Airlines Inc.,SFO,"San Francisco, CA: San Francisco International",56,13,10.29,0.87,0.84,0,1,0,0,392,319,33,16,0,24
2015,2,HA,Hawaiian Airlines Inc.,SJC,"San Jose, CA: Norman Y. Mineta San Jose International",56,12,9.58,0,0,0,2.42,0,0,322,262,0,0,0,60
2015,2,HA,Hawaiian Airlines Inc.,JFK,"New York, NY: John F. Kennedy International",20,6,4.79,0.98,0.07,0,0.16,0,0,1746,1501,238,2,0,5
2015,2,MQ,Envoy Air,CID,"Cedar Rapids/Iowa City, IA: The Eastern Iowa",248,99,27.59,15.79,27.55,0,28.07,33,1,6963,1974,1007,1715,0,2267
